ID;Title;URI;Erfasst
1667652XX;Technische Ausbildungsleitung Standort Hannover (m/w/divers);https://www.continental-jobs.com/index.php?ac=jobad&id=1667652&jobId=202004BR;2021-11-29
1596624XX;Specialist Talent Management & Organization Development (m/w/divers);https://www.continental-jobs.com/index.php?ac=jobad&id=1596624&jobId=193774BR;2021-11-29
1643936XX;Specialist Labor Operational Excellence Management (m/f/diverse);https://www.continental-jobs.com/index.php?ac=jobad&id=1643936&jobId=197226BR;2021-11-29
1654413XX;Senior Specialist Talent Mgmt&Organizational Development (m/f/diverse);https://www.continental-jobs.com/index.php?ac=jobad&id=1654413&jobId=203192BR;2021-11-29
1650131XX;Recruiting Specialist (m/w/divers) - befristet für 2 Jahre;https://www.continental-jobs.com/index.php?ac=jobad&id=1650131&jobId=201970BR;2021-11-29
1642676XX;IT-Koordinator des Konzernbetriebsrats (m/w/divers);https://www.continental-jobs.com/index.php?ac=jobad&id=1642676&jobId=184812BR;2021-11-29
1672066XX;Working Student - Talent Management (m/f/diverse);https://www.continental-jobs.com/index.php?ac=jobad&id=1672066&jobId=189075BR;2021-12-15
1674940XX;Specialist Sustainability Carbon & Lifecycle Accounting (m/f/diverse);https://www.continental-jobs.com/index.php?ac=jobad&id=1674940&jobId=202467BR;2021-12-15
1678131XX;Specialist Sustainability Accounting & Reporting (m/w/divers);https://www.continental-jobs.com/index.php?ac=jobad&id=1678131&jobId=202465BR;2021-12-15
1676572XX;Payroll Administrator/Manager Entgeltabrechnung (m/w/divers) befristet;https://www.continental-jobs.com/index.php?ac=jobad&id=1676572&jobId=206480BR;2021-12-15
1674941XX;Manager Customer Sustainability Requirements Framework (m/f/diverse);https://www.continental-jobs.com/index.php?ac=jobad&id=1674941&jobId=202468BR;2021-12-15
1643936XX;Labor Operational Excellence Manager (m/f/diverse);https://www.continental-jobs.com/index.php?ac=jobad&id=1643936&jobId=197226BR;2021-12-15
1689899XX;TMOD HR Group Functions (Program Specialist) (m/f/diverse) in TZ 50%;https://www.continental-jobs.com/index.php?ac=jobad&id=1689899&jobId=204449BR;2022-01-05
1685184XX;Mediengestalter für HR Kommunikation (m/w/divers);https://www.continental-jobs.com/index.php?ac=jobad&id=1685184&jobId=206044BR;2022-01-05
190049BR;Data Analyst Schwerpunkt Pricing bei Vergölst (m/w/divers);https://www.continental-jobs.com/index.php?ac=jobad&id=1640445&jobId=190049BR;2022-01-13
207329BR;HR Business Partner (m/w/divers);https://www.continental-jobs.com/index.php?ac=jobad&id=1703780&jobId=207329BR;2022-01-13
196783BR;Consultant - Continental Business Consulting (m/f/diverse);https://www.continental-jobs.com/index.php?ac=jobad&id=1655967&jobId=196783BR;2022-01-13
197518BR;IT Consultant - R&D Planning Processes (m/f/diverse);https://www.continental-jobs.com/index.php?ac=jobad&id=1618126&jobId=197518BR;2022-01-13
196145BR;S/4 IT Functional SD / TM Consultant (m/f/diverse);https://www.continental-jobs.com/index.php?ac=jobad&id=1630028&jobId=196145BR;2022-01-13
204449BR;TMOD HR Group Functions (Program Specialist) (m/f/diverse) in TZ 50%;https://www.continental-jobs.com/index.php?ac=jobad&id=1689899&jobId=204449BR;2022-01-13
194727BR;Engineer  Automation technology (m/f/diverse);https://www.continental-jobs.com/index.php?ac=jobad&id=1691366&jobId=194727BR;2022-01-13
191324BR;Engineer Automation Technology (m/f/diverse);https://www.continental-jobs.com/index.php?ac=jobad&id=1651734&jobId=191324BR;2022-01-13
199316BR;Data Scientist (m/f/diverse);https://www.continental-jobs.com/index.php?ac=jobad&id=1643938&jobId=199316BR;2022-01-13
193577BR;Software Engineer for Automation and Control Engineering (m/f/diverse);https://www.continental-jobs.com/index.php?ac=jobad&id=1594500&jobId=193577BR;2022-01-13
198748BR;IT Consultant - Digital Workflows (m/f/diverse);https://www.continental-jobs.com/index.php?ac=jobad&id=1679546&jobId=198748BR;2022-01-13
205122BR;IT Communications Manager and Project Consultant (m/f/diverse);https://www.continental-jobs.com/index.php?ac=jobad&id=1702445&jobId=205122BR;2022-01-13
205170BR;Group Internal IT Auditor (m/f/diverse);https://www.continental-jobs.com/index.php?ac=jobad&id=1676566&jobId=205170BR;2022-01-13
205107BR;Audit Case Manager (m/f/diverse);https://www.continental-jobs.com/index.php?ac=jobad&id=1676565&jobId=205107BR;2022-01-13
190663BR;FleetFox Product Owner (m/f/diverse) - limited until 31.12.2022;https://www.continental-jobs.com/index.php?ac=jobad&id=1642677&jobId=190663BR;2022-01-13
194717BR;Business Architect Fleet Solutions (m/f/diverse);https://www.continental-jobs.com/index.php?ac=jobad&id=1616728&jobId=194717BR;2022-01-13
185115BR;Electrical Project Engineer - Extrusion and Calendering (m/f/diverse);https://www.continental-jobs.com/index.php?ac=jobad&id=1590947&jobId=185115BR;2022-01-13
206480BR;Payroll Administrator/Manager Entgeltabrechnung (m/w/divers) befristet;https://www.continental-jobs.com/index.php?ac=jobad&id=1676572&jobId=206480BR;2022-01-13
197226BR;Labor Operational Excellence Manager (m/f/diverse);https://www.continental-jobs.com/index.php?ac=jobad&id=1643936&jobId=197226BR;2022-01-13
195119BR;IT CPQ / CRM Solution Architect (m/f/diverse);https://www.continental-jobs.com/index.php?ac=jobad&id=1634049&jobId=195119BR;2022-01-13
197931BR;Global Product Information Manager (PIM) (m/f/diverse);https://www.continental-jobs.com/index.php?ac=jobad&id=1628423&jobId=197931BR;2022-01-13
196580BR;Mechanical Development and Design Engineer (m/f/diverse);https://www.continental-jobs.com/index.php?ac=jobad&id=1618123&jobId=196580BR;2022-01-13
198158BR;Customer Experience Manager EMEA (m/f/diverse);https://www.continental-jobs.com/index.php?ac=jobad&id=1657017&jobId=198158BR;2022-01-13
195501BR;IT Architect, Salesforce Application Developer (m/f/diverse);https://www.continental-jobs.com/index.php?ac=jobad&id=1645203&jobId=195501BR;2022-01-13
202467BR;Specialist Sustainability Carbon & Lifecycle Accounting (m/f/diverse);https://www.continental-jobs.com/index.php?ac=jobad&id=1674940&jobId=202467BR;2022-01-13
206641BR;HR IT Consultant MySuccess Platform (m/f/diverse);https://www.continental-jobs.com/index.php?ac=jobad&id=1709200&jobId=206641BR;2022-01-17
208869BR;HR Business Partner (m/w/divers);https://www.continental-jobs.com/index.php?ac=jobad&id=1707350&jobId=208869BR;2022-01-17
207782BR;Specialist HR Talent Management (TMOD) (m/w/divers);https://www.continental-jobs.com/index.php?ac=jobad&id=1709203&jobId=207782BR;2022-01-17
206319BR;Data Analyst (m/f/diverse);https://www.continental-jobs.com/index.php?ac=jobad&id=1712363&jobId=206319BR;2022-01-25
202101BR;HR Operations Analyst (m/w/divers);https://www.continental-jobs.com/index.php?ac=jobad&id=1719889&jobId=202101BR;2022-01-25
199690BR;Demand Planning Analyst (m/f/diverse);https://www.continental-jobs.com/index.php?ac=jobad&id=1719876&jobId=199690BR;2022-01-25
210332BR;IT Project Manager SWP and HR Analytics (m/f/diverse) limited 31.12.22;https://www.continental-jobs.com/index.php?ac=jobad&id=1721911&jobId=210332BR;2022-01-25
206641BR;HR IT Consultant SAP SuccessFactors Platform (m/f/diverse);https://www.continental-jobs.com/index.php?ac=jobad&id=1709200&jobId=206641BR;2022-01-25
206570BR;Technical Application Specialist SCM (m/f/diverse);https://www.continental-jobs.com/index.php?ac=jobad&id=1710797&jobId=206570BR;2022-01-25
207432BR;ISCM - Global Key User Raw Material Planning (m/f/diverse);https://www.continental-jobs.com/index.php?ac=jobad&id=1717210&jobId=207432BR;2022-01-25
206430BR;UX/UI Designer (m/f/diverse);https://www.continental-jobs.com/index.php?ac=jobad&id=1712364&jobId=206430BR;2022-01-25
195969BR;Regional Key User Transportation Management System (m/f/diverse);https://www.continental-jobs.com/index.php?ac=jobad&id=1707336&jobId=195969BR;2022-01-25
209567BR;Quality Manager OE Customer Specific Requirements (m/f/diverse);https://www.continental-jobs.com/index.php?ac=jobad&id=1717511&jobId=209567BR;2022-01-25
207122BR;Finance Manager - Konzernfinanzierung (m/w/divers);https://www.continental-jobs.com/index.php?ac=jobad&id=1715867&jobId=207122BR;2022-01-25
207689BR;Quality Engineer (m/f/diverse) Curing & Final Finish;https://www.continental-jobs.com/index.php?ac=jobad&id=1719907&jobId=207689BR;2022-01-25
168422BR;Software engineer with focus on printed electronics (m/f/diverse);https://www.continental-jobs.com/index.php?ac=jobad&id=1574366&jobId=168422BR;2022-01-25
206585BR;Senior Consultant - Finance CBC (m/f/diverse);https://www.continental-jobs.com/index.php?ac=jobad&id=1727409&jobId=206585BR;2022-01-29
206908BR;Quality Manager Systemic Improvement Program Tires (m/f/diverse);https://www.continental-jobs.com/index.php?ac=jobad&id=1727411&jobId=206908BR;2022-01-29
208446BR;Central Controller - Energy Cost Coordinator (m/w/divers);https://www.continental-jobs.com/index.php?ac=jobad&id=1727415&jobId=208446BR;2022-01-29
210466BR;Live & Sales Communications Manager (m/f/diverse) - limited;https://www.continental-jobs.com/index.php?ac=jobad&id=1725334&jobId=210466BR;2022-01-29
212080BR;HR Business Partner IT & Controlling Tires (m/f/diverse);https://www.continental-jobs.com/index.php?ac=jobad&id=1731848&jobId=212080BR;2022-02-03
206433BR;Cloud Architect (m/f/diverse);https://www.continental-jobs.com/index.php?ac=jobad&id=1729949&jobId=206433BR;2022-02-03
209293BR;Technical Customer Service Engineer PLT (m/f/diverse);https://www.continental-jobs.com/index.php?ac=jobad&id=1731841&jobId=209293BR;2022-02-03
209344BR;Industrial Engineer und Inklusionsbeauftragter (m/w/divers);https://www.continental-jobs.com/index.php?ac=jobad&id=1729956&jobId=209344BR;2022-02-03
206661BR;Cloud Software Engineer (for AWS and AZURE) (m/f/diverse);https://www.continental-jobs.com/index.php?ac=jobad&id=1729952&jobId=206661BR;2022-02-03
206656BR;AWS Cloud Architect (m/f/diverse);https://www.continental-jobs.com/index.php?ac=jobad&id=1729950&jobId=206656BR;2022-02-03
207483BR;Umwelt- und Arbeitssicherheitsingenieur (m/w/divers);https://www.continental-jobs.com/index.php?ac=jobad&id=1729954&jobId=207483BR;2022-02-03
205052BR;Environmental and Occupational Safety Engineer (m/f/diverse);https://www.continental-jobs.com/index.php?ac=jobad&id=1729946&jobId=205052BR;2022-02-03
206662BR;Cloud Security Engineer (for AWS & AZURE) (m/f/diverse);https://www.continental-jobs.com/index.php?ac=jobad&id=1729953&jobId=206662BR;2022-02-03
206660BR;AZURE Cloud Architect (m/f/diverse);https://www.continental-jobs.com/index.php?ac=jobad&id=1729951&jobId=206660BR;2022-02-03
191302BR;Forensic Tire Investigation Analyst (m/f/diverse);https://www.continental-jobs.com/index.php?ac=jobad&id=1630027&jobId=191302BR;2022-02-08
207422BR;Forensic Tires Uniformity & Ride Analyst (m/f/diverse);https://www.continental-jobs.com/index.php?ac=jobad&id=1736514&jobId=207422BR;2022-02-08
206552BR;Key User EDI Business Area SSL (m/f/diverse);https://www.continental-jobs.com/index.php?ac=jobad&id=1736512&jobId=206552BR;2022-02-08
192918BR;Mechanical Development and Design Engineer (m/f/diverse);https://www.continental-jobs.com/index.php?ac=jobad&id=1733484&jobId=192918BR;2022-02-08
198938BR;Quality Assurance & Product Conformity Manager - R&D(m/f/diverse);https://www.continental-jobs.com/index.php?ac=jobad&id=1736506&jobId=198938BR;2022-02-08
207048BR;Chemielaborant für den Bereich PUR (m/w/divers);https://www.continental-jobs.com/index.php?ac=jobad&id=1736515&jobId=207048BR;2022-02-08
205479BR;Chemiker mit Schwerpunkt Polyurethan (PUR) (m/w/divers);https://www.continental-jobs.com/index.php?ac=jobad&id=1736511&jobId=205479BR;2022-02-08
211782BR;Sachbearbeiter Einkauf NPM (m/w/divers);https://www.continental-jobs.com/index.php?ac=jobad&id=1734931&jobId=211782BR;2022-02-08
210865BR;Software Development Engineer for FEM Solutions (m/f/diverse);https://www.continental-jobs.com/index.php?ac=jobad&id=1736536&jobId=210865BR;2022-02-08
208043BR;Frontend SW Developer (m/f/diverse);https://www.continental-jobs.com/index.php?ac=jobad&id=1736521&jobId=208043BR;2022-02-08
208626BR;Mitarbeiter Anlagenbuchhaltung CRD (m/w/divers);https://www.continental-jobs.com/index.php?ac=jobad&id=1710811&jobId=208626BR;2022-02-08
203691BR;Mitarbeiter Ordermanagement (m/w/divers) in Teilzeit - befr.31.12.23;https://www.continental-jobs.com/index.php?ac=jobad&id=1734921&jobId=203691BR;2022-02-08
